<?xml version="1.0" encoding="UTF-8"?>
<aeropuerto xmlns:xsi="http://www.w3.org/2001/XMLSchema-instance"
    xsi:noNamespaceSchemaLocation="Ejercicio24_Prueba.xsd">
    <nombre>JFK</nombre>
    <vuelos>
        <vuelo código="V22" estado="R">
            <diario />
            <origen>New York</origen>
            <destino>Chicago</destino>
            <hora-salida>09:30:00</hora-salida>
            <hora-llegada>11:30:00</hora-llegada>
        </vuelo>
        <vuelo código="V23" estado="C">
            <origen>New York</origen>
            <destino>Miami</destino>
            <hora-salida>10:15:00</hora-salida>
            <hora-llegada>11:15:00</hora-llegada>
        </vuelo>
    </vuelos>
    <fecha>2013-12-20</fecha>
</aeropuerto>